{
  "contract": "TaskPlanSnapshot/v1",
  "initiative": "pilot",
  "review": {
    "artifacts_sha256": {
      "decisions/ADR-PILOT-SCOPE.md": "41b17de932f912d3f0d8302bde86f2ee49e78bf7043550c9c8ed62c7226c9f75",
      "evidence.jsonl": "08f02f7954d1eefc5eb61c74c2756b664733a1500c4e5ae7d640f8286e04f722",
      "intent.md": "fdc5caec623c5ef6628d978246590e5a31be287886b1b18214fba1f960cdf8d4",
      "legs/LEG-SMALL-FIX.md": "b34a9b25e0122faed9e485d24ba3d064cd1119d75c4443ef6b57ccc51a04bb65",
      "proposed-graph.json": "e790394b5070732a38f4bffc781001558b66c13731d9d8c4b6a471a7b8b64a1f",
      "seam-map.yaml": "65eae8f21530df7f0d399839dd2cf923563ca40108eb18f860b8b303edad1d36",
      "seams/SEAM-SMALL-FIX.md": "587669dd8141915e86603a2da655b88baeb1930c60ab3fd5966998e069a6da08",
      "source-recipe.yaml": "89030d18d6c7ced6a8f6d5c3caa0e1ba12b6bbe3501f74178a8320c3e9cb5397",
      "steel-thread.md": "4eb13fd026eb6d48b5f3daa30b89aec67fcd3e91a48400d61abb4b1483bd7fa7",
      "swimlanes/LANE-SMALL-FIX.md": "76167b3a8a0d2d6e95a7c921709e2b4bbeb72cb8b7ffefbdf24d1b20b2f51597",
      "system-map.md": "1c42801107b87d6ba0a9feca42cc84bde631f399cf2f8496a9704a5ec58dfca4"
    },
    "disposition": "accepted",
    "draft_sha256": "53af2caf9cbf9334187ab7392c1bc219220197f741b3ad9f6af61040e9126b70",
    "fixture": false,
    "plan_sha256": "22e70d346be367524ebe768aa4efd3399ff22e2ef3d8d6c1feaa358e82ed1e90",
    "reason": "Standing user pilot authorization for the registered fixed scope; controller review is automated and is not a newly observed human intervention.",
    "recipe_sha256": "89030d18d6c7ced6a8f6d5c3caa0e1ba12b6bbe3501f74178a8320c3e9cb5397",
    "reviewed_at": "2026-09-14T20:57:21.841939+00:00",
    "reviewer": "pilot-controller",
    "schema_version": 1,
    "signature": "hmac-taskplan-v1:ae1c251f:65a1692e0e6e9fa162f5e41df9ba8950df8e9e24dbba5511793c4348f4597899",
    "topology_sha256": "e790394b5070732a38f4bffc781001558b66c13731d9d8c4b6a471a7b8b64a1f"
  },
  "reviewed_artifacts": {
    "decisions/ADR-PILOT-SCOPE.md": {
      "sha256": "41b17de932f912d3f0d8302bde86f2ee49e78bf7043550c9c8ed62c7226c9f75",
      "content": "---\nschema_version: 1\nkind: decision\nid: ADR-PILOT-SCOPE\nstatus: accepted\nowner: pilot-supervisor\nrationale: The user authorized real repository issues with prospective intervention recording. This fixed\n  corpus defines the evaluated scope before execution; it does not claim a new human review occurred during\n  each run.\n---\n# ADR-PILOT-SCOPE\n\nStatus: **accepted**\n\nOwner: pilot-supervisor\n\n## Rationale\n\nThe user authorized real repository issues with prospective intervention recording. This fixed corpus defines the evaluated scope before execution; it does not claim a new human review occurred during each run.\n"
    },
    "evidence.jsonl": {
      "sha256": "08f02f7954d1eefc5eb61c74c2756b664733a1500c4e5ae7d640f8286e04f722",
      "content": "{\"claim\":\"current\",\"confidence\":1.0,\"id\":\"E-PILOT-ISSUE\",\"source\":{\"captured_at\":\"2026-09-14T20:20:46.550715+00:00\",\"sha256\":\"0644414bcd86c5f0db2533901eb442e352d7feaf0cadf526a7e0dc9d392add23\",\"uri\":\"tests/fixtures/toolkit/pilot-issue.json\"},\"summary\":\"A repository issue inspected before comparative execution; source digests and reproduction are retained.\"}\n"
    },
    "intent.md": {
      "sha256": "fdc5caec623c5ef6628d978246590e5a31be287886b1b18214fba1f960cdf8d4",
      "content": "---\nschema_version: 1\nkind: delivery-intent\nid: DI-PILOT-SMALL-FIX\ntitle: Valid execution recipes cannot be piped to recipe validate -\nclaim: proposed\nsource:\n  uri: tests/fixtures/toolkit/pilot-issue.json\n  captured_at: '2026-09-14T20:20:46.550715+00:00'\n  sha256: 0644414bcd86c5f0db2533901eb442e352d7feaf0cadf526a7e0dc9d392add23\nsuccess:\n- Accept valid stdin JSON and reject malformed stdin with the same typed errors as file input; preserve\n  file validation.\nout_of_scope:\n- Changes outside the registered write surface.\n- Production deployment, policy changes, self-authorization, and independent agents.\n---\n# Valid execution recipes cannot be piped to recipe validate -\n\n## Delivery outcome\n\nAccept valid stdin JSON and reject malformed stdin with the same typed errors as file input; preserve file validation.\n\n## Evidence boundary\n\nThis artifact records a **proposed** claim. Its source, capture time,\nand content hash are recorded in frontmatter; the claim is not implementation\nevidence by itself.\n"
    },
    "legs/LEG-SMALL-FIX.md": {
      "sha256": "b34a9b25e0122faed9e485d24ba3d064cd1119d75c4443ef6b57ccc51a04bb65",
      "content": "---\nschema_version: 1\nkind: capability-leg\nclaim: derived\nid: LEG-SMALL-FIX\nseam_id: SEAM-SMALL-FIX\nswimlane_id: LANE-SMALL-FIX\nobservable_state: Accept valid stdin JSON and reject malformed stdin with the same typed errors as file\n  input; preserve file validation.\nproof: The declared evaluator succeeds without widening the write surface.\nrequires: []\nproduces:\n- small-fix verified behavior\ntasks:\n- id: T-20260914-pilot-small-fix\n  title: Accept valid stdin JSON and reject malformed stdin with the same typed errors as file input;\n    preserve file validation\n  goal: Accept valid stdin JSON and reject malformed stdin with the same typed errors as file input; preserve\n    file validation.\n  done_condition: Accept valid stdin JSON and reject malformed stdin with the same typed errors as file\n    input; preserve file validation.\n  effort: S\n  profile: standard\n  execution_backend: claude\n  required_tools:\n  - git\n  - bash\n  - python3\n  depends_on: []\n  touches_paths:\n  - src/recipe/recipes.py\n  creates_paths: []\n  behavior:\n  - id: B-1\n    given: the registered repository issue and fixed authorized scope\n    when: the bounded implementation is independently evaluated\n    then: the declared behavior passes without modifying unrelated files or promoting reported evidence\n  - id: B-2\n    given: the recorded evidence and authorization boundary\n    when: the candidate is checked\n    then: source evidence is unchanged and no unrelated write is present\n  evals:\n  - id: eval_1\n    description: Independent behavioral proof for small-fix\n    bash: /Users/luanmorenomaciel/GitHub/task-spec/.taskspec/runtime/decompose/bin/python /Users/luanmorenomaciel/GitHub/task-spec/tests/evals/toolkit/evaluate_issue.py\n      small-fix --root .\n    verifies:\n    - B-1\n  - id: eval_2\n    description: Declared write surface only\n    bash: /Users/luanmorenomaciel/GitHub/task-spec/.taskspec/runtime/decompose/bin/python /Users/luanmorenomaciel/GitHub/task-spec/tests/evals/toolkit/evaluate_issue.py\n      write-boundary --root .\n    verifies:\n    - B-2\n  - id: eval_3\n    description: Registered issue evidence is unchanged\n    bash: /Users/luanmorenomaciel/GitHub/task-spec/.taskspec/runtime/decompose/bin/python /Users/luanmorenomaciel/GitHub/task-spec/tests/evals/toolkit/evaluate_issue.py\n      source-integrity --root .\n    verifies:\n    - B-2\n  anti_patterns:\n  - action: weaken the independent evaluator\n    reason: it would invalidate the comparison\n    instead: fix the behavior within the declared surface\n  - action: expand the scope\n    reason: it breaks matched permissions\n    instead: report the missing work as a blocker\n  - action: claim success without evidence\n    reason: a plausible patch does not establish behavior\n    instead: run the independent proof and report failures\n  do_not_touch:\n  - tests/fixtures/toolkit/pilot-issue.json\n  - tasks\n  rollback: Revert only this isolated candidate change.\n  observability: Retained provider output, evaluation result, and prospective event journal.\n  execution_recipe: diagnose-repair-verify\n  proves_capabilities:\n  - LEG-SMALL-FIX\nsource_seam_sha256: 587669dd8141915e86603a2da655b88baeb1930c60ab3fd5966998e069a6da08\n---\n# Accept valid stdin JSON and reject malformed stdin with the same typed errors as file input; preserve file validation.\n\n## Observable proof\n\nThe declared evaluator succeeds without widening the write surface.\n\n## Runnable leaves\n\n- `T-20260914-pilot-small-fix` \u2014 Accept valid stdin JSON and reject malformed stdin with the same typed errors as file input; preserve file validation: Accept valid stdin JSON and reject malformed stdin with the same typed errors as file input; preserve file validation.\n\nThe leg names a capability state, not an activity. Each leaf owns one coherent,\nindependently provable done-condition.\n"
    },
    "proposed-graph.json": {
      "sha256": "e790394b5070732a38f4bffc781001558b66c13731d9d8c4b6a471a7b8b64a1f",
      "content": "{\n  \"schema_version\": 1,\n  \"status\": \"TASK_GRAPH=READY\",\n  \"plan_sha256\": \"53af2caf9cbf9334187ab7392c1bc219220197f741b3ad9f6af61040e9126b70\",\n  \"nodes\": [\n    {\n      \"id\": \"T-20260914-pilot-small-fix\",\n      \"title\": \"Accept valid stdin JSON and reject malformed stdin with the same typed errors as file input; preserve file validation\",\n      \"seam_id\": \"SEAM-SMALL-FIX\",\n      \"swimlane_id\": \"LANE-SMALL-FIX\",\n      \"leg_id\": \"LEG-SMALL-FIX\",\n      \"effort\": \"S\",\n      \"profile\": \"standard\",\n      \"done_condition\": \"Accept valid stdin JSON and reject malformed stdin with the same typed errors as file input; preserve file validation.\",\n      \"touches_paths\": [\n        \"src/recipe/recipes.py\"\n      ],\n      \"creates_paths\": []\n    }\n  ],\n  \"edges\": [],\n  \"contentions\": [],\n  \"critical_path\": [\n    \"T-20260914-pilot-small-fix\"\n  ],\n  \"critical_path_mermaid_sha256\": \"b74c7eb7a8ec0e4abe6719a2b69f1909145e6e6480182af4134be107fdafcdfb\"\n}\n"
    },
    "seam-map.yaml": {
      "sha256": "65eae8f21530df7f0d399839dd2cf923563ca40108eb18f860b8b303edad1d36",